<?xml version="1.0" encoding="UTF-8"?>

<!ELEMENT project-record (head,team,abstract,deliver) >
<!ELEMENT head (key-name,title,subtitle?,begin-date,end-date,supervisor) >
<!ELEMENT key-name (#PCDATA) >
<!ELEMENT title (#PCDATA) >
<!ELEMENT subtitle (#PCDATA) >
<!ELEMENT begin-date (#PCDATA) >
<!ELEMENT end-date (#PCDATA) >
<!ELEMENT supervisor (#PCDATA) >
<!ATTLIST supervisor 
            href CDATA #REQUIRED >
<!ELEMENT team (member+) >
<!ELEMENT member (#PCDATA) >
<!ATTLIST member
            id ID #REQUIRED
            email CDATA #REQUIRED >
<!ELEMENT abstract (paragraph+) >
<!ELEMENT paragraph (#PCDATA | bold | italic)* >
<!ELEMENT bold (#PCDATA) >
<!ELEMENT italic (#PCDATA) >
<!ELEMENT deliver (doc+) >
<!ELEMENT doc (#PCDATA) >
<!ATTLIST doc
            href CDATA #REQUIRED>